{
  "decision": "ROLLBACK",
  "experiment": "guardrail-breach",
  "expgate_version": "0.1.0",
  "input": {
    "arms": {
      "control": {
        "metrics": {
          "conversion": {
            "successes": 2955
          },
          "latency_ms": {
            "mean": 39.944146,
            "sd": 11.926928
          },
          "refund_rate": {
            "successes": 590
          }
        },
        "units": 30000
      },
      "treatment": {
        "metrics": {
          "conversion": {
            "successes": 3444
          },
          "latency_ms": {
            "mean": 52.049467,
            "sd": 12.000093
          },
          "refund_rate": {
            "successes": 618
          }
        },
        "units": 30000
      }
    },
    "assignment": {
      "expected_treatment_share": 0.5
    },
    "description": "Candidate lifts conversion but adds 12 ms of decision latency",
    "experiment": "guardrail-breach",
    "metrics": {
      "conversion": {
        "direction": "increase",
        "role": "primary",
        "type": "proportion"
      },
      "latency_ms": {
        "direction": "decrease",
        "margin": 2.0,
        "role": "guardrail",
        "type": "mean"
      },
      "refund_rate": {
        "direction": "decrease",
        "margin": 0.003,
        "role": "guardrail",
        "type": "proportion"
      }
    },
    "seed": 20260924
  },
  "input_sha256": "b6be4e6bb33a80e2733285a8408a364c7be1d94215a7bbcec7aab4e390a42aaf",
  "metrics": [
    {
      "control": 0.0985,
      "diff": 0.016299999999999995,
      "direction": "increase",
      "improvement": 0.016299999999999995,
      "improvement_bounds": [
        0.012155983854689618,
        0.02044401614531037
      ],
      "mde": 0.006264382312253869,
      "mde_basis": "fixed_horizon_normal_approximation",
      "metric": "conversion",
      "role": "primary",
      "se": 0.0025193829270941195,
      "status": "IMPROVED",
      "treatment": 0.1148,
      "type": "proportion",
      "z": 1.6448536269514715
    },
    {
      "control": 39.944146,
      "diff": 12.105320999999996,
      "direction": "decrease",
      "improvement": -12.105320999999996,
      "improvement_bounds": [
        -12.296774419240805,
        -11.913867580759188
      ],
      "margin": 2.0,
      "mde": 0.27366475788998024,
      "mde_basis": "fixed_horizon_normal_approximation",
      "metric": "latency_ms",
      "role": "guardrail",
      "se": 0.09768211087089813,
      "status": "BREACH",
      "treatment": 52.049467,
      "type": "mean",
      "z": 1.9599639845400534
    },
    {
      "control": 0.019666666666666666,
      "diff": 0.0009333333333333346,
      "direction": "decrease",
      "improvement": -0.0009333333333333346,
      "improvement_bounds": [
        -0.00318104913294987,
        0.0013143824662832006
      ],
      "margin": 0.003,
      "mde": 0.003212899526928,
      "mde_basis": "fixed_horizon_normal_approximation",
      "metric": "refund_rate",
      "role": "guardrail",
      "se": 0.0011468148483065157,
      "status": "INCONCLUSIVE",
      "treatment": 0.0206,
      "type": "proportion",
      "z": 1.9599639845400534
    }
  ],
  "policy": {
    "alpha": 0.05,
    "power": 0.8,
    "srm_alpha": 0.001
  },
  "produced_by": {
    "name": "expgate",
    "version": "0.1.0"
  },
  "reasons": [
    "guardrail latency_ms breached its margin"
  ],
  "sample_ratio": {
    "control_units": 30000,
    "expected_treatment_share": 0.5,
    "p_value": 1.0,
    "pass": true,
    "treatment_units": 30000
  },
  "schema_version": 2
}